Bloco;Bairro;Data;Desfile;Local da Concentraçao;Percurso;Público Estimado
Ninho dos Cobras;Madureira;13/02/2018;18:00;Rua Carvalho de Souza, embaixo do Viaduto de Madureira;Rua Carvalho de Souza, Av. Ministro Edgard Romero e Estrada do Portela até a Rua Dagmar da Fonseca;800
Unidos do Caraxué;Ilha de Paquetá;17/02/2018;16:00;Rua cerqueira 74;Rua cerqueira 74 até a praia dos coqueiros, Esquerda na Rua padre juvenal, termino no praça são roque;100
Fuzuê... Só Alegria Pra Você!;Del Castilho;03/02/2018;18:00;Rua Chapadinha, nº 02;Rua Chapadinha, Rua Lagoa Verde, Rua Lagoa Clara, Rua Lagoa Redonda, Rua Chapadinha e Rua Palmeira do Norte;2000
Fuzuê... Só Alegria Pra Você!;Del Castilho;17/02/2018;18:00;Rua Chapadinha, nº 02;Rua Chapadinha, Rua Lagoa Verde, Rua Lagoa Clara, Rua Lagoa Redonda, Rua Chapadinha e Rua Palmeira do Norte;2000
Banda do Largo da 2ª Feira;Tijuca;13/02/2018;18:00;Rua Conde de Bonfim, 25;Rua Conde de Bonfim, Rua Haddock Lobo, Rua Campos Salles, Rua Doutor Satamini, Rua São Francisco Xavier e Rua Conde de Bonfim até o nº 25;6000
Bonecas Deslumbradas de Olaria;Olaria;11/02/2018;18:00;Rua Conselheiro Paulino, nº 567;Rua Conselheiro Paulino, Rua Antônio Rêgo, Rua Lígia, Rua Wandelkok e Rua Conselheiro Paulino;4000
Bonecas Deslumbradas de Olaria;Olaria;13/02/2018;18:00;Rua Conselheiro Paulino, nº 567;Rua Conselheiro Paulino, Rua João Rêgo, Paranapanema, Rua Delfim Carlos, Praca Belmonte, Rua João Rêgo e Rua Conselheiro Paulino;4000
Banda da Constança Barbosa - Galo do Méier;Méier;12/02/2018;18:00;Rua Constança Barbosa, em frente ao nº 212;Rua Constança Barbosa, Rua Manuela Barbosa, Rua Dias da Cruz, Rua Magalhães Couto e Rua Manuela Barbosa;1000
Na Pressão Eu Vou;Campo Grande;10/02/2018;14:00;Avenida Cesário de Melo, esquina com Coronel Agostinho;Rua Coronel Agostinho, Rua Viúva Dantas, seguindo até a esquina da José Ferreira;1000
Bambas do Curuzu;São Cristóvão;12/02/2018;18:00;Rua Curuzu, nº 87;Rua Curuzu, Rua Alves Monte, Rua Coronel Cabrita, Praça Argentina, Rua Coronel Brandão e Rua Tuiuti - Curuzu;1500
Bloco do Tamanco;Padre Miguel;10/02/2018;13:00;Rua D, 19;Rua D, Figueiredo Camargo até o campo do Bangu e volta;3500
Banda da Glória;Glória;13/02/2018;16:00;Rua da Glória 180;Rua da Glória 180, Rua Américo, Rua do catete, Rua da Glória;1000
Arteiros da Glória;Glória;12/02/2018;17:00;Rua da Glória, nº 190;Rua da Glória, Rua do Catete, Rua Antonio Mendes Campos, Largo da Glória, Av. Augusto Severo e Rua da Glória;2000
Fome Zero;Madureira;11/02/2018;15:00;Rua Dagmar da Fonseca;Rua Dagmar da Fonseca, Av. Edgard Ramero, Est. Do Portela, e retorna a origem.;1000
Acorda e vem Brincar;Vila Valqueire;04/02/2018;13:00;Rua das Dálias;Rua das Dálias, Rua das Verbenas, Rua das Camélias e Rua das Dálias;1000
Banda da Saens Pena;Tijuca;13/02/2018;19:00;Rua Desembargador Izidro, nº 4;Rua Desembargador Izidro, Rua Abelardo Barbosa, Rua Conde de Bonfim, Rua Pareto, Rua Almirante Cochrane, Rua Santo Afonso e Rua General Roca;1000
Papo de Cachaça;Méier;12/02/2018;19:00;Rua Dias da Cruz, 269;Rua Dias da Cruz, do nº 269 ao nº 111, retornando ao local de concentração;600
Banda do Mackenzie;Méier;10/02/2018;18:00;Rua Dias da Cruz, 561;Rua Dias da Cruz, do nº 561 até a Rua Magalhães Couto, retornando ao local de concentração;1500
Turma do Gato Futebol e Samba;Pilares;10/02/2018;17:00;Rua Djalma Dutra, nº 110;Rua Djalma Dutra, Av. Dom Hélder Câmara e Av. João Ribeiro;2000
Bambas do Catete;Catete;13/02/2018;19:00;Praça do Poeta;Rua do Catete, Rua Pedro Américo, Rua Bento Lisboa, Rua Dois de Dezembro e Rua do Catete até a Silveira Martins;1000
Balança Meu Catete;Catete;12/02/2018;18:00;Rua do Catete 227;Rua do Catete, Rua Pedro Américo, Rua Bento Lisboa, Rua Dois de Dezembro e Rua do Catete, até a esquina com a Buarque de Macedo, retornando ao local de concentração;4000
Amigos do Catete;Catete;10/02/2018;18:00;Rua Dois de Dezembro, esquina com Rua do Catete;Rua do Catete, Rua Pedro Américo, Rua Bento Lisboa, Rua Dois de Dezembro, voltando ao local de concentração;1000
Se Me Der, Eu Como!;Tijuca;13/02/2018;17:00;Praça da Medalha Milagrosa;Rua do Matoso, Rua Haddock Lobo, Rua Barão de Ubá, Rua Joaquim Palhares, Barão de Iguatemi.;3000
Banda da Rua do Mercado;Centro;08/02/2018;19:00;Rua do Mercado;Rua do Mercado, Simbolo Olimpico, Rua do Mercado;8000
Bloco do Show do Antonio Carlos;Glória;10/02/2018;12:30;Rua do Russel, nº 434;Rua do Russel, Largo da Glória, Av. Augusto Severo (junto as edificções), Rua Mestre Valentim e Av. Luis de Vasconcelos (junto ao Passeio).;3000
Fome Zero;Madureira;10/02/2018;15:00;Rua Domingos Fernandes;Rua Domingos Fernandes, Rua Leopoldina de Oliveira, Rua Nunes de Souza e Rua Domingos Fernandes;1000
Acabou o Amor;Ilha do Governador;12/02/2018;18:00;Rua Domingos Mundin, em frente a Cedae;Rua Domingos Mundin e Rua Euzebio de Farias 26;500
Carioca da Gema;Lapa;10/02/2018;16:00;Rua dos Arcos, 24 - em frente à Fundição Progresso;Rua dos Arcos, 24 - em frente à Fundição Progresso (Parado em palco montado em frente a Fundição);1000
Sem Noção;Lapa;12/02/2018;14:00;Rua dos Arcos, em frente a Fundição Progresso;Rua dos Arcos, Rua do Lavradio, Rua do Senado, Rua dos Inválidos, Rua da Relação até Av. Gomes Freire;2000
Planta na Mente;Lapa;14/02/2018;16:20;Praça Cardeal Câmara (Arcos da Lapa);Rua dos Arcos, Rua do Lavradio, Rua do Senado, Rua Pedro I, Rua Visconde do Rio Branco e Praça Tiradentes;1000
Banda da Inválidos;Lapa;11/02/2018;18:30;Rua dos Inválidos, entre Av. Mem de Sá e Henrique Valadares;Rua dos Inválidos, Rua do Senado, Rua Ubaldino do Amaral, Av.Henrique Valadares, Rua dos Inválidos,;1000
Banda da Inválidos;Lapa;12/02/2018;18:30;Rua dos Inválidos, entre Av. Mem de Sá e Henrique Valadares;Rua dos Inválidos, Rua do Senado, Rua Ubaldino do Amaral, Av.Henrique Valadares, Rua dos Inválidos,;1000
Banda da Inválidos;Lapa;13/02/2018;18:30;Rua dos Inválidos, entre Av. Mem de Sá e Henrique Valadares;Rua dos Inválidos, Rua do Senado, Rua Ubaldino do Amaral, Av.Henrique Valadares, Rua dos Inválidos,;1000
Independente do Morro do Pinto;Santo Cristo;28/01/2018;16:00;Rua Farnese, em frente ao nº 83;Rua Farnese, Rua Saldanha Marinho, Rua Mariano Procópio,  Rua Sara, Rua Mont Alverne;500
Batuke de Batom;Ilha do Governador;13/02/2018;12:00;Praça Iaiá Garcia;Rua Fernandes da Fonseca, Rua Paramopama, retorno a origem.;2000
Eu Não Venho Mais Aqui;Abolição;03/02/2018;18:00;Rua Gaspar, esquina com Rua Ferreira Leite;Rua Ferreira Leite, da Rua Gaspar até a Rua Glaziou, retornando ao local de concentração;300
Bonde da Folia;Santa Teresa;18/02/2018;14:00;Rua Fonseca Guimarães;Rua Fonseca Guimarães, Rua Paschoal Carlos Magno, Rua almirante Alexandrino, Rua Dias de Barros e Largo do Curvelo;500
Virilha de Minhoca;Bangu;10/02/2018;19:00;Rua Fonseca 1078;Rua fonseca, rua oliveira ribeiro, Av. Cônego de Vasconcelos, Rua Santa Cecilia, Rua Fonseca;6000
Virilha de Minhoca;Bangu;11/02/2018;19:00;Rua Fonseca 1078;Rua fonseca, rua oliveira ribeiro, Av. Cônego de Vasconcelos, Rua Santa Cecilia, Rua Fonseca;6000
Virilha de Minhoca;Bangu;12/02/2018;19:00;Rua Fonseca 1078;Rua fonseca, rua oliveira ribeiro, Av. Cônego de Vasconcelos, Rua Santa Cecilia, Rua Fonseca;6000
Virilha de Minhoca;Bangu;13/02/2018;19:00;Rua Fonseca 1078;Rua fonseca, rua oliveira ribeiro, Av. Cônego de Vasconcelos, Rua Santa Cecilia, Rua Fonseca;6000
Virilha de Minhoca;Bangu;18/02/2018;19:00;Rua Fonseca 1078;Rua fonseca, rua oliveira ribeiro, Av. Cônego de Vasconcelos, Rua Santa Cecilia, Rua Fonseca;6000
Fúria de Bangu;Bangu;12/02/2018;19:00;Rua Boiobi;Rua Francisco Barreto, Rio Biobi, Silva  Rua Banguense, Rangel Pestana, Silva Cardoso, Santa Cecília, encerrando na praça da Fé.;500
Imprensa Que Eu Gamo;Laranjeiras;27/01/2018;15:00;Rua Gago Coutinho, em frente ao Mercadinho São José;Rua Gago Coutinho, Largo do Machado, Rua das Laranjeiras e Rua Gago Coutinho;15000
Que Merda é Essa?!;Ipanema;11/02/2018;14:30;Rua Garcia D'avila, esquina com Rua Nascimento Silva;Rua Garcia D'avila, Avenida Vieira Souto, seguindo até O Jardim de Alah;2000
Nem Muda Nem Sai de Cima;Tijuca;27/01/2018;19:00;Rua Garibaldi, esquina com Avenida Maracanã;Rua Garibaldi, Rua Pinto Guedes, Praça Xavier de Brito, Rua Otávio Kelly, Rua Conde de Bonfim e Rua Garibaldi, voltando ao local de concentração;1000
GB Bloco;Laranjeiras;27/01/2018;15:00;Praça Jardim Laranjeiras - Rua General Glicério;Rua General Glicério, Rua General Cristóvão Barcelos, retornando à Praça Jardim Laranjeiras;5000
Gigantes da Lira (infantil);Laranjeiras;04/02/2018;09:00;Praça Jardim Laranjeiras - Rua General Glicério;Rua General Glicério, Rua General Cristóvão Barcelos, retornando à Praça Jardim Laranjeiras;6000
Laranjada Samba Clube;Laranjeiras;11/02/2018;11:00;Praça Jardim Laranjeiras - Rua General Glicério;Rua General Glicério, Rua General Cristóvão Barcelos, retornando à Praça Jardim Laranjeiras;900
Sem Saída;Botafogo;17/02/2018;16:00;Rua General Severiano, em frente ao nº 70;Rua General Severiano, Rua Venceslau Brás, Av. Pasteur e Rua Bartolomeu Portela;1200
Banda de Ipanema;Ipanema;27/01/2018;17:30;Rua Jangadeiros, esquina com Gomes Carneiro;Rua Gomes Carneiro, Avenida Vieira Souto, Rua Joana Angélica e Rua Visconde de Pirajá, até a Praça General Osório;50000
Banda de Ipanema;Ipanema;10/02/2018;17:30;Rua Jangadeiros, esquina com Gomes Carneiro;Rua Gomes Carneiro, Avenida Vieira Souto, Rua Joana Angélica e Rua Visconde de Pirajá, até a Praça General Osório;90000
Banda de Ipanema;Ipanema;13/02/2018;17:30;Rua Jangadeiros, esquina com Gomes Carneiro;Rua Gomes Carneiro, Avenida Vieira Souto, Rua Joana Angélica e Rua Visconde de Pirajá, até a Praça General Osório;90000
Zona Mental;Bangu;06/02/2018;15:00;Praça de Guilherme da Silveira;Rua Guilherme da Silveira, Rua Sidney, Rua Figueiredo Camargo (Ponto Chic), Rua Santana, Marechal Mariano, e Retorna para a praça Guilherme pela Rua Ribeiro Dantas;350
Vermelho e Preto Coirmãos;Padre Miguel;12/02/2018;19:30;Rua Helianto;Rua Helianto, Rua Olimpia Esteves, Rua Vila Nova e retorna para Helianto.;500
Larga a Onça, Alfredo!;Laranjeiras;04/02/2018;18:00;Rua Ipiranga, em frente ao nº 49;Rua Ipiranga, Rua Esteves Junior e Praça São Salvador;2000
Suvaco do Cristo;Jardim Botânico;04/02/2018;10:00;Rua Jardim Botânico, esquina com Rua Faro;Rua Jardim Botânico, da Rua Faro até a Praça Santos Dumont;35000
Escangalha!;Jardim Botânico;10/02/2018;10:00;Rua Jardim Botânico, esquina com Rua Pacheco Leão;Rua Jardim Botânico, da Rua Pacheco Leão até a Praça Santos Dumont;7000
Me Esquece;Jardim Botânico;28/01/2018;10:00;Rua Jardim Botânico, esquina com Rua Pacheco Leão;Rua Jardim Botânico, da Rua Pacheco Leão até a Praça Santos Dumont;5000
Pede Passagem;Jardim Botânico;12/02/2018;12:00;Rua Jardim Botânico, esquina com Rua Pacheco Leão;Rua Jardim Botânico, da Rua Pacheco Leão até a Praça Santos Dumont;1000
Vagalume O Verde;Jardim Botânico;13/02/2018;10:00;Rua Jardim Botânico, esquina com Rua Pacheco Leão;Rua Jardim Botânico, da Rua Pacheco Leão até a Praça Santos Dumont;10000
Panela Preta de Curicica;Curicica;27/01/2018;16:00;Rua João Bruno Lobo, nº 38;Rua João Bruno Lobo, nº 38 - Parado;1000
Ciganas Feiticeiras de Olaria;Olaria;10/02/2018;19:00;Rua Paranhos, esquina com João Rego;Rua João Rego, Rua Delfim Carlos, Rua Paranhos até origem.;1000
Ciganas Feiticeiras de Olaria;Olaria;12/02/2018;19:00;Rua Paranhos, esquina com João Rego;Rua João Rego, Rua Delfim Carlos, Rua Paranhos até origem.;1000
Ciganas Feiticeiras de Olaria;Olaria;17/02/2018;19:00;Rua Paranhos, esquina com João Rego;Rua João Rego, Rua Delfim Carlos, Rua Paranhos até origem.;1000
Amigos da Joaquim Méier;Méier;10/02/2018;20:00;Rua Joaquim Méier, 213;Rua Joaquim Méier, Rua Guaju, Rua Oliveira, Rua Dias da Cruz até  a José Veríssimo, retornando pela Rua Dias da Cruz, Rua Oliveira, Rua Guaju e Rua Joaquim Méier;4000
Imaginô? Agora Amassa!;Leblon;03/02/2018;09:00;Rua José Linhares, esquina com Rua Conde de Bernadote;Rua José Linhares, Avenida Ataulfo de Paiva, seguindo até a esquina da Carlos Góis;10000
Bloco dus Impussivi;Centro;08/02/2018;20:00;Rua Lélio Gama, esquina com Avenida Chile;Rua Lélio Gama, Av. chile, Rua Senador Dantas , Rua Lélio Gama;2000
Alegria do Guarabu;Ilha do Governador;13/02/2018;14:00;Rua Luis Gomes (Pedreira);Rua Luis Gomes, Rua Inhoverá, Rua Dr. leon Roussoulieres, Rua Tramandaí, Rua Estocolmo, Rua Genebra, Rua Catalpa, Rua Flamarion, Rua Berna e Rua Luis Gomes;1000
O Fervo;Estácio;23/01/2018;18:00;Rua Maia de Lacerda;Rua Maia de Lacerda, da esquina da Rua Estácio de Sá até a Rua Sampaio Ferraz e termina na rua Quintino do Vale;500
O Fervo;Estácio;17/02/2018;18:00;Rua Maia de Lacerda;Rua Maia de Lacerda, da esquina da Rua Estácio de Sá até a Rua Sampaio Ferraz e termina na rua Quintino do Vale;500
Garganta Seca de Irajá;Irajá;04/02/2018;15:00;Rua Manoel de Araújo;Rua Manoel de Araújo, Rua Hanibal Porto até a Estrada da Água Grande;700
Rola Preguiçosa - Tarda mas não falha;Ipanema;09/02/2018;20:00;Rua Maria Quitéria, esquina com Epitácio Pessoa;Rua Maria Quitéria, Av. Visconde de Pirajá e Rua Vinícius de Moraes;15000
Xodó da Piedade;Piedade;11/02/2018;17:00;Rua Mario Carpenter, Esquina com Angelina;Rua Mario Carpenter, Rua Leopoldina, Rua João Pinheiro, Av. Dom Helder Camara, Rua Ferreira Sampaio, Rua Ernesto Nunes, Angelina e finaliza na Rua Mario Carpenter;1500
Serrote Afiado;Engenho da Rainha;03/02/2018;20:00;Rua Mario ferreira, 217;Rua Mario Ferreira, Rua Ferreira de Menezes, Rua pereira pinto, Rua Carlos Gonçalves Penna.;1000
Boka de Espuma;Botafogo;04/02/2018;18:00;Rua Marquês de Olinda, esquina com Rua Bambina;Rua Marquês de Olinda, Rua Muniz Barreto, Rua São Clemente, Rua Bambina e Rua Marquês de Olinda;30000
Boka de Espuma;Botafogo;18/02/2018;18:00;Rua Marquês de Olinda, esquina com Rua Bambina;Rua Marquês de Olinda, Rua Muniz Barreto, Rua São Clemente, Rua Bambina e Rua Marquês de Olinda;30000
Bloco de Segunda;Humaitá;12/02/2018;17:00;Rua Marques, atrás da Cobal do Humaitá;Rua Marques, Voluntários da Pátria, Rua Martins Ferreira, Rua São Clemente e Rua Marques;5000
Vou Treinar e Volto Já;Tijuca;13/01/2018;17:00;Rua Martins Pena;Rua Martins Pena, Rua Afonso Pena, Rua Haddock Lobo, Rua Campos Sales, Rua Martins Pena;500
Seca Copo;Ilha do Governador;12/02/2018;15:00;Rua Monjolos 546;Rua Monjolos, Praia da Pitangueiras, Rua Formosa, Est. Rio Jequiá, Rua Monjolos e volta a concentração;900
Só Cachaça;Santo Cristo;11/02/2018;17:00;Rua Nabuco de Freitas;Rua Nabuco de Freitas (ida e volta);500
Unidos do Complexo do Alemão;Bonsucesso;13/02/2018;18:00;Rua Nova Brasília;Rua Nova Brasília 02 até a Praça do Terço N°5;1000
Alegria de Quintino;Quintino Bocaiúva;11/02/2018;17:00;Rua Olina;Rua Olina, Rua Barros Leite, Elias da Silva, Nerval de Gouveia e finaliza na Praça de Quintino;300
Explosão de Paquetá;Ilha de Paquetá;11/02/2018;16:00;Praça São Roque;Rua Padre Juvenal, Rua Dr. Aristão, Curva da Pedra, Rua José Bonifácio, Rua Furkin Werneck, Praça das Barcas.;600
Vem Comigo Cachaçada;Ilha do Governador;17/02/2018;17:00;Rua Paramopama, em frente ao restaurante Bom Demais;Rua Paramopama, do Restaurante Bom Demais até a Praça da Ribeira, contornando a Praça e voltando ao local de concentração;1500
Porre Certo;Praça Seca;11/02/2018;17:00;Rua Carimã, esquina com Rua Parintins;Rua Parintins, Rua Florianópolis, Rua Urucuia, Rua Luiz Beltrão, Rua Parintins e Rua Carimã;500
Céu na Terra;Santa Teresa;03/02/2018;08:00;Largo dos Guimarães;Rua Pascoal Carlos Magno, Rua Monte Alegre, Rua Oriente, Rua Progresso, Largo das Neves;7000
Banda Devassa;Penha;17/02/2018;20:00;Rua Patagônia;Rua Patagônia, Rua Quito, Rua Montevidéu, Rua Nicarágua e Rua Patagônia;4000
Amigos da Sueca da Pedro Américo;Catete;13/02/2018;18:00;Rua Pedro Américo, nº 371;Rua Pedro Américo, Rua Bento Lisboa, Rua Dois de Dezembro, Rua do Catete e Rua Pedro Américo;950
Canela Fina;Quintino Bocaiúva;13/02/2018;18:00;Rua Pedro Reis;Rua Pedro Reis, Argentina Reis, Travessa Guerra, João Barbalho, 21 de Abril, Nervalde Gouveia, Praça de Quintino;200
Nova Geração do Zumbi;Ilha do Governador;12/02/2018;13:00;Rua Serrão, esquina com Rua Peixoto de Carvalho;Rua Peixoto de Carvalho, Estrada do Rio Jequiá, Rua Maldonado, Rua Fernandes da Fonseca, Rua Paramopama, Est. Do Jequiá, Peixoto de Carvalho;10000
Verde e Branco do Zumbi;Ilha do Governador;10/02/2018;11:00;Rua Peixoto de Carvalho;Rua Peixoto de Carvalho, Praia do Zumbi, Rua Pojuca, Estrada do Rio Jequiá, Rua Gaspar de Souza e Rua Peixoto de Carvalho;600
Amigos da Esquina;Engenho de Dentro;03/02/2018;20:00;Rua Pernambuco 886;Rua Pernambuco, Rua Barbacena e Rua Pernambuco;1000
Amigos da Esquina;Engenho de Dentro;10/02/2018;20:00;Rua Pernambuco 886;Rua Pernambuco, Rua Barbacena e Rua Pernambuco;1000
Alegria do Sapê;Bento Ribeiro;03/02/2018;15:00;Rua Picui;Rua Picui 895  até o número 500, Largo do Sapê e volta;800
Balanço do Pinto;Tijuca;11/02/2018;20:00;Rua Pinto de Figueiredo, nº 26;Rua Pinto de Figueiredo, Avenida Maracanã, Rua Barão de Mesquita, Rua General Roca, Rua Conde de Bonfim e Rua Pinto de Figueiredo;1000
Banda do Jiló;Tijuca;09/02/2018;21:00;Rua Pinto de Figueiredo, nº 26;Rua Pinto de Figueiredo, Avenida Maracanã, Rua Barão de Mesquita, Rua General Roca, Rua Conde de Bonfim e Rua Pinto de Figueiredo;1000
Banda do Tio Marco;Piedade;07/02/2018;20:00;Largo da Rua Porto Valter;RUA PORTO VALTER, RUA PADRE NOBREGA, RUA ANTONIO VARGAS, RUA GONÇALO COELHO, RUA SOUZA CERQUEIRA, Av don Helder Camara, Padre Nobrega, Porto valter;3000
Ainda Aguento;Ilha do Governador;14/02/2018;11:00;Praia da Engenhoca;Rua Praia da Engenhoca, Rua Novo Airão, Rua Fernandes da Fonseca, Pça Iaiá Garcia e retorna para origem pelo trajeto inverso.;800
Quem Num Guenta Bebe Água;Ilha de Paquetá;12/02/2018;15:00;Praia dos Tamoios;Rua Praia do Tamoios, Rua Furkin Werneck, Rua Pinheiro Freire, Rua Principe Regente, Rua Doutor Aristão e Praia das Moreninhas.;500
Loucura Suburbana;Engenho de Dentro;08/02/2018;17:00;Instituto Municipal Nise da Silveira, Rua Ramiro Magalhães;Rua Ramiro Magalhães, Rua Gustavo Riedel, Rua Pernambuco, Praça Rio Grande do Norte, Rua Ana Leonídia, Rua Gustavo Riedel e Rua Ramiro Magalhães;1000
Leão da Pedra;Santo Cristo;12/02/2018;17:00;Rua Rego Barros;Rua Rego Barro e retorna pela Rua Nabuco de Freitas até a origem;300
Unidos do Rego Barros;Santo Cristo;13/01/2018;17:00;Rua Rego Barros;Rua Rego Barros até o fim da rua Nabuco de Freitas, e termina na Rua Rego Barros;400
Banda do Peru Pelado;Copacabana;13/02/2018;17:00;Avenida Atlântica, esquina com República do Peru;Rua República do Peru, Rua Barata Ribeiro, Rua Siqueira Campos e Avenida Atlântica até a esquina com República do Peru;1500
Quizomba;Lapa;17/02/2018;10:00;Rua do Riachuelo  nº7;Rua Riachuelo, Av. Mem de Sá, Rua Teixeira de Freitas, Av. Augusto Severo;5000
Encosta que Ele Cresce;Vista Alegre;03/02/2018;17:00;Rua Ribadejo;Rua Ribadejo, Estrada da Água Grande 800 até o 1525, supermercado intercontinental e retorna do outro lado;1000
GRBC Deixa Que Eu Te Atravesso;Brás de Pina;04/02/2018;17:00;Rua Rio Preto;Rua Rio Preto, Rua Brasiléia, Rua Alm. Ingran Margini, Rua Dezoito de Setembro, Rua Valdemar Magrini, até Rua Rio Preto;1000
GRBC Deixa Que Eu Te Atravesso;Brás de Pina;17/02/2018;17:00;Rua Rio Preto;Rua Rio Preto, Rua Brasiléia, Rua Alm. Ingran Margini, Rua Dezoito de Setembro, Rua Valdemar Magrini, até Rua Rio Preto;1000
Banda Bandida;Copacabana;03/02/2018;16:00;Rua Rodolfo Dantas;Rua Rodolfo Dantas, Rua Barata Ribeiro, Rua Hilário de Gouveia, Avenida Nossa Senhora de Copacabana e volta Rua Rodolfo Dantas;2000
Bloco Carnavalesco Bunda Rachada;Ramos;27/01/2018;18:00;Rua romero zander , N. 363;rua romero zander n. 363, Av. dos campeoes n.569;2000
Discípulos do Oswaldo;Manguinhos;24/01/2018;20:00;Rua Rosa da Fonseca;Rua Rosa da Fonseca Rua Castro Tavares, Rua Sizenando Nabuco e Rua Rosa da Fonseca;1000
Discípulos do Oswaldo;Manguinhos;31/01/2018;20:00;Rua Rosa da Fonseca;Rua Rosa da Fonseca Rua Castro Tavares, Rua Sizenando Nabuco e Rua Rosa da Fonseca;1000
Banda do Riviera;Barra da Tijuca;12/02/2018;17:00;Rua Rosalinda Brant, Condomínio Riviera;Rua Rosalinda Brant, Rua Celso Kelly, Rua Afrânio Costa, Rua Professor Dulcídio Cardoso e Rua Rosalinda Brant;2500
Banda Sá Ferreira;Copacabana;10/02/2018;16:00;Calçadão da Rua Sá Ferreira com Av. Atlântica;Rua Sá Ferreira, Bulhões de Carvalho, Francisco Otaviano, Av. Atlântica com Sá Ferreira;2000
Coração das Meninas;Saúde;28/01/2018;18:00;Largo da Prainha;Rua Sacadura Cabral ao Largo da Prainha até Praça da Harmonia;500
Liga de Blocos e Bandas da Zona Portuária;Saúde;27/01/2018;12:00;Praça Coronel Assunção (Praça da Harmonia);Rua Sacadura Cabral, da Praça da Harmonia até o Largo São Francisco da Prainha;1500
Escorrega Mas Não Cai;Saúde;09/02/2018;19:00;Praça Coronel Assunção (Praça da Harmonia);Rua Sacadura Cabral, Rua Aníbal Falcão, Rua Coelho e Castro, Rua Edgard Gordilho e Largo São Francisco da Prainha;1000
Batuke de Ciata;Saúde;03/02/2018;17:00;Praça Coronel Assunção (Praça da Harmonia);Rua Sacadura Cabral, Rua Argemiro Bulcao, Pedra do Sal.;500
Afoxé Filhos de Gandhi;Gamboa;11/02/2018;18:00;Praça da Harmonia;Rua Sacadura Cabral, Rua Camerino e Praça dos Estivadores;500
Pipoca no Mel;Gamboa;04/02/2018;17:00;Praça Coronel Assumpção (Praça da Harmonia);Rua Sacadura Cabral, Rua do Livramento, Rua Rivadavia Correa, Rua Pedro Ernesto e retorna para Praça da Harmonia;1000
Queima de Bangu;Bangu;11/02/2018;20:00;Rua Agrícola;Rua Santa Cecília, seguindo até a Rua Fonseca (Dispersão);500
Vamos que Vamos;Campo Grande;10/02/2018;18:00;Rua Santo Amando;Rua Santo Amando, Rua Damião de Goes, Rua São Potito, Rua Henri Dunant e retorno a origem;600
Raízes da Vila da Penha;Vila da Penha;11/02/2018;14:00;Rua São João Gualberto;Rua São João Gualberto, Rua General Silveira Sobrinho, Rua Oliveira Belo,  Rua Alice Tibiriça e Rua São João Gualberto;900
Raízes da Vila da Penha;Vila da Penha;12/02/2018;15:00;Rua São João Gualberto;Rua São João Gualberto, Rua General Silveira Sobrinho, Rua Oliveira Belo,  Rua Alice Tibiriça e Rua São João Gualberto;900
Raízes da Vila da Penha;Vila da Penha;13/02/2018;15:00;Rua São João Gualberto;Rua São João Gualberto, Rua General Silveira Sobrinho, Rua Oliveira Belo,  Rua Alice Tibiriça e Rua São João Gualberto;900
Molha o Pé das Oito;Centro;02/02/2018;20:00;Buraco do Lume;Rua São José, Rua Rodrigo Solva, Rua da Assembléia, Rua do Carmo e Rua São José;500
Semente do Amanhã;São Cristóvão;10/02/2018;16:00;Rua São Luiz Gonzaga 966;Rua São Luiz Gonzaga 966, Largo da Cancela e Dispersão na Av. Rotary Internacional na Entrada da Quinta da Boa Vista;500
Chora 10;Tijuca;10/02/2018;19:00;Rua São Miguel, 430;Rua São Miguel, Rua Santa Carolina, Avenida Maracanã, Rua São Rafael e Rua São Miguel;1000
Boca Aberta;Bonsucesso;03/02/2018;18:00;Praça da Nova Holanda;Rua Sargento Silva nunes, Rua Principal, Rua São Jorge;400
Cata Latas do Grajaú;Grajaú;13/02/2018;21:00;Praça Nobel;Rua Saviana, Rua Rosa e Silva, Rua Campinas, Rua Uberaba, Rua Botucatu, Rua Barão de Mesquita e Largo do Verdun;2500
Butano na Bureta;Maracanã;03/02/2018;13:00;Rua Senador Furtado, esquina com Rua Pará;Rua Senador Furtado, da Rua Pará até a Avenida Radial Oeste, voltando pela Senador Furtado até a concentração;1000
Bangay Folia;Padre Miguel;16/02/2018;20:00;Rua Sidney com Rua Figueiredo Camargo;Rua Sidney com Figueiredo Camargo, Rua Figueiredo Camargo com Ponto Chic, Rua Figueiredo Camargo com Rua D;500
Banda da Amizade;Lapa;04/02/2018;17:00;Rua Tadeu Kosciusco;Rua Tadeu Kosciusko, Carlos Sampaio, Washington Luiz, Conselheiro Josino, Henrique Valadares, Cruz Vermelha, Carlos Sampaio  e Rua Tadeu Kosciusko;1000
Banda da Amizade;Lapa;11/02/2018;17:00;Rua Tadeu Kosciusco;Rua Tadeu Kosciusko, Carlos Sampaio, Washington Luiz, Conselheiro Josino, Henrique Valadares, Cruz Vermelha, Carlos Sampaio  e Rua Tadeu Kosciusko;1000
Banda da Amizade;Lapa;13/02/2018;17:00;Rua Tadeu Kosciusco;Rua Tadeu Kosciusko, Rua do Rezende, Rua Ubaldino de Amaral, Rua Washington Luiz, Rua Conselheiro Josino, Av. Henrique Valadares, Praça da Cruz Vermelha, Rua Carlos Sampaio e Rua Tadeu Kosciusko;1000
Bafo do Peru;Padre Miguel;11/02/2018;18:00;Rua Tapiranga (Largo);Rua Tapiranga, Rua Icote, Rua Ceriba, Rua Pedro Melo, Rua Maria Rosa, Largo da Tapiranga;800
Bafo do Peru;Padre Miguel;13/02/2018;18:00;Rua Tapiranga (Largo);Rua Tapiranga, Rua Icote, Rua Ceriba, Rua Pedro Melo, Rua Maria Rosa, Largo da Tapiranga;800
Banana Com Queijo;Realengo;13/02/2018;16:00;Rua Tecobé;Rua Tecobé, Rua ibitú, Rua João Luso, Rua Ocabí, Rua Silva Neto, Rua Iguarim, Rua Acú, Rua Mirim, Rua Tecobé 275 Término;1000
Simpatia é Quase Amor;Ipanema;03/02/2018;16:00;Teixeira de Melo – Praia;Rua Teixeira de Melo e Avenida Vieira Souto até a Henrique Dumont;300000
Simpatia é Quase Amor;Ipanema;11/02/2018;16:00;Teixeira de Melo – Praia;Rua Teixeira de Melo e Avenida Vieira Souto até a Henrique Dumont;300000
Seu Kuka é Eu do Grajaú;Grajaú;10/02/2018;19:00;Largo Maria Martha Ward;Rua Teodoro da Silva, Rua José Vicente, Rua Meira Vasconcelos, Rua Faria de Brito, Rua Barão de Mesquita e Largo Irma Maria Marta Ward;1200
Fuzuê da Ilha;Ilha do Governador;04/02/2018;15:00;Praça do Grego;Rua Uça, da Praça do Grego até a Rua Engenheiro Rozauro Zambrano, voltando ao local de concentração;500
