Bloco;Bairro;Data;Desfile;Local da Concentraçao;Percurso;Público Estimado
Acadêmicos do Engenho de Dentro;Engenho de Dentro;13/02/2018;18:00;Rua Venâncio Ribeiro, 585;Rua Venâncio Ribeiro, Rua Maria Paula, Rua Catulo CearenSe e Rua Adolfo Bergamini;1000
Calma, Calma Sua Piranha;Botafogo;28/01/2018;10:00;Rua Visconde de Caravelas, esquina com Rua Real Grandeza;Rua Visconde de Caravelas, da Rua Real Grandeza até a Rua Capitão Salomão;500
Só Tamborins;Lapa;16/02/2018;20:00;Travessa do Mosqueira, esquina com Rua Visconde de Maranguape;Rua Visconde de Maranguape, Rua da Lapa, Rua da Glória, seguindo até o Largo da Glória;2500
Pinta Mas Não Borra;Botafogo;10/02/2018;17:30;Rua Voluntários da Pátria, nº 34;Rua Voluntários da Pátria, nº 34, Rua São Clemente, nº 1, Rua Nelson Mandela e Rua Voluntários da Pátria até o nº 34;7000
Fala Meu Louro;Santo Cristo;28/01/2018;16:00;Rua Waldemar Dutra, 19;Rua Waldemar Dutra, Praça do Santo Cristo, Rua da América, Rua Barão da Gamboa, Rua Cardoso Marinho, Rua Santo Cristo e Rua Waldemar Dutra.;800
Areia;Leblon;11/02/2018;10:00;Posto 12;Sai do posto 12 até o posto 11;10000
Sobrinhos do Tio Bio;Leblon;13/02/2018;11:00;Posto 12;Sai do posto 12 até o posto 11;3000
Bloco do Balde;Sulacap;03/02/2018;18:00;Praça H (Rua Antonio de Mendonça);Saída Rua Antonio de Mendonça, Rua Teofilo Guimarães, Rua Gonçalo Rollemberg, Rua Barbara Heliodor, Rua Teodoro Sampaio, Rua Oliveira Martins, Rua Maria Grham, Para na Praça Nino Roland, Retorno, Maria Grham, Rua Oliveira Martins, Rua Teodoro Sampaio, Rua Guilherme Francisco Cruz, Rua Olimpio de Castro e término na Rua Antonio de Mendonça.;500
Foliões da ABRACES;Copacabana;04/02/2018;11:00;Constante Ramos com Domingos Ferreira;Saindo da esquina da Contante Ramos com Domingos Ferreira, andar até orla e seguir Av. Atlântica até o posto 2;1000
Banda Inimigos da Bebida;Ilha do Governador;12/02/2018;11:00;Praça Comandante Megé;Saindo da Praça Comandante Magé, Rua Altinópolis, Beira da Praia da Bandeira, seguindo em direção ao Detran, dobrando no Fórum da Ilha do Governador e encerrando na Praça Comandante Megé;900
Baile do Negrão;Madureira;13/02/2018;17:30;Viaduto Negrão de Lima;Saindo da Rua Carvalho de Souza 241 indo até o palanque Rua dos Peixinhos Rua Edgard Romero 81;5000
Confraria da Bebidinha;Abolição;03/02/2018;16:00;Rua da Abolição 671;Saindo da Rua da Abolição, 671 (Calçada do Banco Itaú) pela Rua da Abolição até a esquina da Rua Mario Carpenter e retorno pela Rua Abolição até o local da Concentração;1000
Vem Que Eu Te Abraço;Padre Miguel;11/02/2018;14:00;Rua da Caridade 116;Saindo da Rua da Caridade, Rua Figueiredo e voltando para a Rua da Caridade;800
Banda da Barra;Barra da Tijuca;04/02/2018;15:00;Em frente ao condomíno Beton (Bondinho da Barra);Saindo do Bondinho da Barra até a Praça do Ó;50000
Buda da Barra;Barra da Tijuca;11/02/2018;13:00;Em frente ao condomíno Beton (Bondinho da Barra);Saindo do Bondinho da Barra até a Praça do Ó;1000
Primeiro Amor;São Conrado;27/01/2018;10:00;Em frente ao Golfe Clube;Saindo do Golfe Clube até o final;6000
Vira-Lata;São Conrado;27/01/2018;14:00;Em frente ao Golfe Clube;Saindo do Golfe Clube até o final;5000
Carmelitas;Santa Teresa;13/02/2018;10:00;Largo do Curvelo;Saindo do largo do Curvelo, seguindo até altura do Nº200 da Rua Joaquim Murtinho;800
TPM - Turma da Paz de Madureira;Madureira;20/01/2018;17:30;Em frente ao Império Serrano;Segue a Estrada do Portela até antes do Shopping Madureira.;500
Banda Amigos da Barra;Barra da Tijuca;28/01/2018;15:00;Av. Lucio Costa Barramares;Segue na Av. Lucio Costa até a altura da Praça do Ó;5000
Embalo de Santa Tereza;Santa Teresa;13/02/2018;16:30;Largo do França;Segue na Rua Alm. Alexandrino até o Largo do Vista Alegre seguindo até o Largo dos Guimarães onde dispersa.;800
Banda do Andaraí;Andaraí;13/02/2018;18:00;Rua Maxwell 542;Segue na Rua Maxwell até o Largo do Verdun.;500
Bloco Carnavalesco Infantil Sementes do Samba;Vila isabel;10/02/2018;18:00;Av. 28 de Setembro 382;Segue pela 28 de Setembro até a esquina da Rua Visconde de Abaeté;600
Banda Du Rio;Copacabana;11/02/2018;10:00;Posto 6 de Copacabana;Segue pela Av. Atlântica até altura da Rua Miguel Lemos;5000
Ih, É Carnaval!;Urca;02/02/2018;20:00;Av. pasteur 250;Segue pela Av. Pasteur anumero 250 até a Praça Medalha Milagrosa;5000
Bloco da Gold / Giro do Arar;Centro;13/02/2018;10:00;Av. Pres. Antonio Carlos em frente ao Terminal Menezes Cortes;Segue pela Av. Pres. Antonio Carlos até o Ministerio da Fazenda.;5000
Bloco da Preta;Centro;04/02/2018;10:00;Av. Presidente Antonio Carlos em Frente ao Menezes Cortes;Segue pela Av. Pres. Antonio Carlos até o Ministerio da Fazenda.;500000
Bloco das Poderosas;Centro;17/02/2018;09:00;Av. Pres. Antonio Carlos em frente ao Terminal Menezes Cortes;Segue pela Av. Pres. Antonio Carlos até o Ministerio da Fazenda.;200000
Cordão da Bola Preta;Centro;10/02/2018;09:00;Av. Presidente Antonio Carlos em Frente ao Menezes Cortes;Segue pela Av. Pres. Antonio Carlos até o Ministerio da Fazenda.;1500000
Os 20 de Ouro do Mestre Odilon;Ilha do Governador;20/01/2018;16:00;Estrada do Rio Jequiá (Posto Necker Pinto);Segue pela Estrada Rio Jequiá, Rua Maldonado, e Pça Iaiá Garcia;1500
Quem Me Viu Mentiu;Ilha do Governador;11/02/2018;16:00;Praça Jerusalem;Segue pela Praia da Bica Av. Alm. Alves Câmara Junior até o numero 986;2000
Bloco Afro Zimbauê da Ilha;Ilha do Governador;10/02/2018;16:00;Praça da Freguesia;Segue pela Praia da Guanabara e Pça Nossa Senhora da Ajuda.;300
Mistura de Santa;Santa Teresa;03/02/2018;18:00;Mirante do Rato Molhado;Segue pela Rua Aprazível até dispersar na lateral do Castelo São Valentim na parte alta da Rua Almirante Alexandrino.;500
Mistura de Santa;Santa Teresa;17/02/2018;18:00;Mirante do Rato Molhado;Segue pela Rua Aprazível até dispersar na lateral do Castelo São Valentim na parte alta da Rua Almirante Alexandrino.;500
Me Enterra na Quarta;Santa Teresa;14/02/2018;17:00;Praça Odílio Costa;Segue pela Rua Áurea até Rua Alm. Alexandrino, Rua Joaquim Murtinho e Largo do Curvello.;1500
Badalo de Santa Teresa;Santa Teresa;11/02/2018;17:30;Rua Monte Alegre 306 (em frente ao Centro Cultural);Segue pela Rua do Oriente, Rua Progresso até dispersar no Largo das Neves;1000
Filhos de Ismael;Estácio;04/02/2018;17:00;Praça Compositor Ismael Silva;Segue pela Rua Frei Caneca, Rua Visc. De Pirassununga, Rua Salvador de Sá, Rua do Estácio retorno na Rua São Carlos, Rua do Estácio até a origem.;2000
Muceludos de Padre Miguel;Padre Miguel;13/02/2018;17:00;Rua Pedro Melo 579;Segue pela Rua Japeju, Rua Olimpia Esteves, Rua Murundú, Rua Ceriba, Rua Maria Rosa, Largo da Tapiranga;300
Fofoqueiros de Plantão;Jardim Botânico;18/02/2018;12:00;Rua Jardim Botânico, esquina com Rua Pacheco Leão;Segue pela Rua Jardim Botânico até a Pracá Santos Dumont;5000
Bloco dos Aposentados;Centro;09/02/2018;19:00;Buraco do Lume;Segue pelaGraça Aranha, Rua Santa Luzia, Rua México e Buraco do Leme;1200
Chora Me Liga;Aterro do Flamengo;04/02/2018;10:00;Aterro do Flamengo, altura da Praça Luis de Camões - Coreto Modernista;Segue pelo Aterro do Flamengo, com dispersão na Av. Infante Dom Henrique 85 aterro do Flamengo;40000
Monobloco;Aterro do Flamengo;18/02/2018;09:00;Aterro do Flamengo, altura da Praça Luis de Camões - Coreto Modernista;Segue pelo Aterro do Flamengo, com dispersão na Av. Infante Dom Henrique 85 aterro do Flamengo;200000
Orquestra Voadora;Aterro do Flamengo;13/02/2018;15:00;Aterro do Flamengo, altura da Praça Luis de Camões - Coreto Modernista;Segue pelo Aterro do Flamengo, com dispersão na Av. Infante Dom Henrique 85 aterro do Flamengo;80000
Raízes do Varandão;Vila isabel;12/02/2018;17:00;Blv. 28 de Setembro 400, pista da direita;Segue pelo Boulevard em frente a quadra da U. de vila isabel, contorna a praça barao de Drumond, entra na rua  Barão de Cotegipe, Rua Mendes Tavares 73. bar varandão;500
Me Leva que Eu Vou;Bangu;10/02/2018;20:00;Rua Santa Cecília c/ Silva Cardoso;Segue Rua Santa Cecília e finaliza na Rua Santa Cecília com Rua Bangu;500
Bloco Galasextou;São Cristóvão;18/02/2018;20:00;Rua General Almerio de Moura (estacionamento);Segue Rua Teixeira Junior, Rua São Januário, Rua Francisco Palheta, Rua Ricardo Machado e retorna ao destino.;1500
Bloco Virtual;Leme;12/02/2018;09:00;Praça Almirante Julio de Noronha;Seque pela Av. Atlantica até a praça Julio de Noronha;5000
Os Monarcas;Ilha do Governador;03/02/2018;16:00;Praia da Engenhoca (Quiosque 5);Subida Rua Paramopama, retornando pela Praça Iaiá Garcia, pela Fernando da Fonseca, Rua do Airão até a Praia da Engenhoca;500
Unidos do Chapadão;Ramos;09/02/2018;20:00;Travessa dos Campeões;Travessa dos Campeões, Avenida dos Campeões até o nº 1,Rua Sargento Gerreira, TV. Horácio, Rua João Romariz, TV. Sargento Gerreira  voltando a Travessa dos Campeões;800
Unidos da Travessa Miracema;Méier;10/02/2018;19:00;Travessa Miracema;Travessa Miracema, Rua Dias da Cruz até a Magalhães Couto, retornando pela Dias da Cruz até a Travessa Miracema;1200
Pinto Sarado;Santo Cristo;03/02/2018;17:00;Travessa Sara;Travessa Sara, Rua Atilia, Rua Orestes, Rua Sara, Rua Santo Cristo, Rua da América e Rua Barão da Gamboa.;1500
Bloco do Ipê;Tijuca;03/02/2018;17:00;Rua Alm. Cochrane 36;Vira na Rua Dulce até a Rua São Francisco Xavier retornando a origem.;150
Bicho Solto com Desculpa pra Beber;Humaitá;13/02/2018;19:00;Estacionamento da Cobal do Humaitá;Voluntários da Pátria, Rua Conde de Irajá, Largo dos Leões e Rua Marques;3000
É Tudo ou Nada?!;Humaitá;13/02/2018;12:00;Estacionamento da Cobal do Humaitá;Voluntários da Pátria, Rua Conde de Irajá, Largo dos Leões e Rua Marques;3000
